Source,Name,Species,Trajectory,Age,Description
GSE136689,Splanchnic Mesoderm,mmusculus,True,E8.5-9.5,Foregut organogenesis dataset showing interactions between splanchnic mesoderm and definitive endoderm
GSE162534,Primitive Streak,mmusculus,True,Early-Late Streak,Gastrulation dataset analyzing EMT programs during endodermal and mesodermal specification
GSE201257,Schwann Cell Precursor,mmusculus,True,E9.5-Adult,Neural crest cell atlas describing diversification of glial-cell lineages from neurulation to adulthood
GSE229103,Neuromesodermal Progenitor,mmusculus,True,E8.5,Developmental dataset describing bipotent neuromesodermal progenitors in the elongating caudal trunk
HCAEmbryonicHindlimb,Embryonic Hindlimb,hsapiens,True,PCW5-9,Embryonic hindlimb atlas focusing on spatial and temporal gene expression programs
rRNAModifications,Cranial Neural Crest,mmusculus,True,E8.5-10.5,Neural crest cell dataset showing the bifurcation between cranial mesenchyme and neural crest
CCCA,Curated Cancer Cell Atlas,hsapiens,False,Primary & Metastatic,Cancer atlas containing 70+ curated single-cell datasets spanning >100 cancer subtypes